{
  "id": "test-alpha",
  "vendor": "google-cloud",
  "name": {
    "ja": "テスト試験 Alpha",
    "en": "Test exam Alpha"
  },
  "shortName": "ALPHA",
  "guideVersion": "6.1",
  "guideURL": "https://cloud.google.com/learn/certification/cloud-architect",
  "format": {
    "durationMinutes": 120,
    "officialQuestionCount": {
      "min": 50,
      "max": 60
    },
    "questionKinds": [
      "single",
      "multiple"
    ],
    "mockExam": {
      "questionCount": 55,
      "setCount": 6,
      "caseStudiesPerSet": 2
    }
  },
  "scoring": {
    "policy": "allOrNothing"
  },
  "domains": [
    {
      "id": 1,
      "name": {
        "ja": "ダミーのドメイン 1",
        "en": "Dummy domain 1"
      },
      "weight": 0.25,
      "subObjectives": [
        {
          "id": "1.1",
          "name": {
            "ja": "ダミーのサブ項目 1.1",
            "en": "Dummy sub-objective 1.1"
          }
        },
        {
          "id": "1.2",
          "name": {
            "ja": "ダミーのサブ項目 1.2",
            "en": "Dummy sub-objective 1.2"
          }
        },
        {
          "id": "1.3",
          "name": {
            "ja": "ダミーのサブ項目 1.3",
            "en": "Dummy sub-objective 1.3"
          }
        },
        {
          "id": "1.4",
          "name": {
            "ja": "ダミーのサブ項目 1.4",
            "en": "Dummy sub-objective 1.4"
          }
        },
        {
          "id": "1.5",
          "name": {
            "ja": "ダミーのサブ項目 1.5",
            "en": "Dummy sub-objective 1.5"
          }
        }
      ]
    },
    {
      "id": 2,
      "name": {
        "ja": "ダミーのドメイン 2",
        "en": "Dummy domain 2"
      },
      "weight": 0.18,
      "subObjectives": [
        {
          "id": "2.1",
          "name": {
            "ja": "ダミーのサブ項目 2.1",
            "en": "Dummy sub-objective 2.1"
          }
        },
        {
          "id": "2.2",
          "name": {
            "ja": "ダミーのサブ項目 2.2",
            "en": "Dummy sub-objective 2.2"
          }
        },
        {
          "id": "2.3",
          "name": {
            "ja": "ダミーのサブ項目 2.3",
            "en": "Dummy sub-objective 2.3"
          }
        },
        {
          "id": "2.4",
          "name": {
            "ja": "ダミーのサブ項目 2.4",
            "en": "Dummy sub-objective 2.4"
          }
        },
        {
          "id": "2.5",
          "name": {
            "ja": "ダミーのサブ項目 2.5",
            "en": "Dummy sub-objective 2.5"
          }
        }
      ]
    },
    {
      "id": 3,
      "name": {
        "ja": "ダミーのドメイン 3",
        "en": "Dummy domain 3"
      },
      "weight": 0.19,
      "subObjectives": [
        {
          "id": "3.1",
          "name": {
            "ja": "ダミーのサブ項目 3.1",
            "en": "Dummy sub-objective 3.1"
          }
        },
        {
          "id": "3.2",
          "name": {
            "ja": "ダミーのサブ項目 3.2",
            "en": "Dummy sub-objective 3.2"
          }
        }
      ]
    },
    {
      "id": 4,
      "name": {
        "ja": "ダミーのドメイン 4",
        "en": "Dummy domain 4"
      },
      "weight": 0.15,
      "subObjectives": [
        {
          "id": "4.1",
          "name": {
            "ja": "ダミーのサブ項目 4.1",
            "en": "Dummy sub-objective 4.1"
          }
        },
        {
          "id": "4.2",
          "name": {
            "ja": "ダミーのサブ項目 4.2",
            "en": "Dummy sub-objective 4.2"
          }
        },
        {
          "id": "4.3",
          "name": {
            "ja": "ダミーのサブ項目 4.3",
            "en": "Dummy sub-objective 4.3"
          }
        }
      ]
    },
    {
      "id": 5,
      "name": {
        "ja": "ダミーのドメイン 5",
        "en": "Dummy domain 5"
      },
      "weight": 0.115,
      "subObjectives": [
        {
          "id": "5.1",
          "name": {
            "ja": "ダミーのサブ項目 5.1",
            "en": "Dummy sub-objective 5.1"
          }
        },
        {
          "id": "5.2",
          "name": {
            "ja": "ダミーのサブ項目 5.2",
            "en": "Dummy sub-objective 5.2"
          }
        }
      ]
    },
    {
      "id": 6,
      "name": {
        "ja": "ダミーのドメイン 6",
        "en": "Dummy domain 6"
      },
      "weight": 0.115,
      "subObjectives": [
        {
          "id": "6.1",
          "name": {
            "ja": "ダミーのサブ項目 6.1",
            "en": "Dummy sub-objective 6.1"
          }
        },
        {
          "id": "6.2",
          "name": {
            "ja": "ダミーのサブ項目 6.2",
            "en": "Dummy sub-objective 6.2"
          }
        },
        {
          "id": "6.3",
          "name": {
            "ja": "ダミーのサブ項目 6.3",
            "en": "Dummy sub-objective 6.3"
          }
        },
        {
          "id": "6.4",
          "name": {
            "ja": "ダミーのサブ項目 6.4",
            "en": "Dummy sub-objective 6.4"
          }
        },
        {
          "id": "6.5",
          "name": {
            "ja": "ダミーのサブ項目 6.5",
            "en": "Dummy sub-objective 6.5"
          }
        },
        {
          "id": "6.6",
          "name": {
            "ja": "ダミーのサブ項目 6.6",
            "en": "Dummy sub-objective 6.6"
          }
        }
      ]
    }
  ],
  "features": {
    "caseStudies": true,
    "docs": true,
    "flashcards": true,
    "decisionTrees": true,
    "keywordDrills": true
  },
  "taxonomies": {
    "wafPillars": [
      {
        "id": "operationalExcellence",
        "name": {
          "ja": "ダミーの柱 operationalExcellence",
          "en": "Dummy pillar operationalExcellence"
        }
      },
      {
        "id": "security",
        "name": {
          "ja": "ダミーの柱 security",
          "en": "Dummy pillar security"
        }
      },
      {
        "id": "reliability",
        "name": {
          "ja": "ダミーの柱 reliability",
          "en": "Dummy pillar reliability"
        }
      },
      {
        "id": "costOptimization",
        "name": {
          "ja": "ダミーの柱 costOptimization",
          "en": "Dummy pillar costOptimization"
        }
      },
      {
        "id": "performance",
        "name": {
          "ja": "ダミーの柱 performance",
          "en": "Dummy pillar performance"
        }
      },
      {
        "id": "sustainability",
        "name": {
          "ja": "ダミーの柱 sustainability",
          "en": "Dummy pillar sustainability"
        }
      }
    ]
  },
  "caseStudies": [
    "ehr",
    "altostrat"
  ]
}
