{"caseStudies":["ehr","altostrat"],"domains":[{"id":1,"name":{"en":"Dummy domain 1","ja":"ダミーのドメイン 1"},"subObjectives":[{"id":"1.1","name":{"en":"Dummy sub-objective 1.1","ja":"ダミーのサブ項目 1.1"}},{"id":"1.2","name":{"en":"Dummy sub-objective 1.2","ja":"ダミーのサブ項目 1.2"}},{"id":"1.3","name":{"en":"Dummy sub-objective 1.3","ja":"ダミーのサブ項目 1.3"}},{"id":"1.4","name":{"en":"Dummy sub-objective 1.4","ja":"ダミーのサブ項目 1.4"}},{"id":"1.5","name":{"en":"Dummy sub-objective 1.5","ja":"ダミーのサブ項目 1.5"}}],"weight":0.25},{"id":2,"name":{"en":"Dummy domain 2","ja":"ダミーのドメイン 2"},"subObjectives":[{"id":"2.1","name":{"en":"Dummy sub-objective 2.1","ja":"ダミーのサブ項目 2.1"}},{"id":"2.2","name":{"en":"Dummy sub-objective 2.2","ja":"ダミーのサブ項目 2.2"}},{"id":"2.3","name":{"en":"Dummy sub-objective 2.3","ja":"ダミーのサブ項目 2.3"}},{"id":"2.4","name":{"en":"Dummy sub-objective 2.4","ja":"ダミーのサブ項目 2.4"}},{"id":"2.5","name":{"en":"Dummy sub-objective 2.5","ja":"ダミーのサブ項目 2.5"}}],"weight":0.18},{"id":3,"name":{"en":"Dummy domain 3","ja":"ダミーのドメイン 3"},"subObjectives":[{"id":"3.1","name":{"en":"Dummy sub-objective 3.1","ja":"ダミーのサブ項目 3.1"}},{"id":"3.2","name":{"en":"Dummy sub-objective 3.2","ja":"ダミーのサブ項目 3.2"}}],"weight":0.19},{"id":4,"name":{"en":"Dummy domain 4","ja":"ダミーのドメイン 4"},"subObjectives":[{"id":"4.1","name":{"en":"Dummy sub-objective 4.1","ja":"ダミーのサブ項目 4.1"}},{"id":"4.2","name":{"en":"Dummy sub-objective 4.2","ja":"ダミーのサブ項目 4.2"}},{"id":"4.3","name":{"en":"Dummy sub-objective 4.3","ja":"ダミーのサブ項目 4.3"}}],"weight":0.15},{"id":5,"name":{"en":"Dummy domain 5","ja":"ダミーのドメイン 5"},"subObjectives":[{"id":"5.1","name":{"en":"Dummy sub-objective 5.1","ja":"ダミーのサブ項目 5.1"}},{"id":"5.2","name":{"en":"Dummy sub-objective 5.2","ja":"ダミーのサブ項目 5.2"}}],"weight":0.115},{"id":6,"name":{"en":"Dummy domain 6","ja":"ダミーのドメイン 6"},"subObjectives":[{"id":"6.1","name":{"en":"Dummy sub-objective 6.1","ja":"ダミーのサブ項目 6.1"}},{"id":"6.2","name":{"en":"Dummy sub-objective 6.2","ja":"ダミーのサブ項目 6.2"}},{"id":"6.3","name":{"en":"Dummy sub-objective 6.3","ja":"ダミーのサブ項目 6.3"}},{"id":"6.4","name":{"en":"Dummy sub-objective 6.4","ja":"ダミーのサブ項目 6.4"}},{"id":"6.5","name":{"en":"Dummy sub-objective 6.5","ja":"ダミーのサブ項目 6.5"}},{"id":"6.6","name":{"en":"Dummy sub-objective 6.6","ja":"ダミーのサブ項目 6.6"}}],"weight":0.115}],"features":{"caseStudies":true,"decisionTrees":true,"docs":true,"flashcards":true,"keywordDrills":true},"format":{"durationMinutes":120,"mockExam":{"caseStudiesPerSet":2,"questionCount":55,"setCount":6},"officialQuestionCount":{"max":60,"min":50},"questionKinds":["single","multiple"]},"guideURL":"https://cloud.google.com/learn/certification/cloud-architect","guideVersion":"6.1","id":"test-alpha","name":{"en":"Test exam Alpha","ja":"テスト試験 Alpha"},"scoring":{"policy":"allOrNothing"},"shortName":"ALPHA","taxonomies":{"wafPillars":[{"id":"operationalExcellence","name":{"en":"Dummy pillar operationalExcellence","ja":"ダミーの柱 operationalExcellence"}},{"id":"security","name":{"en":"Dummy pillar security","ja":"ダミーの柱 security"}},{"id":"reliability","name":{"en":"Dummy pillar reliability","ja":"ダミーの柱 reliability"}},{"id":"costOptimization","name":{"en":"Dummy pillar costOptimization","ja":"ダミーの柱 costOptimization"}},{"id":"performance","name":{"en":"Dummy pillar performance","ja":"ダミーの柱 performance"}},{"id":"sustainability","name":{"en":"Dummy pillar sustainability","ja":"ダミーの柱 sustainability"}}]},"vendor":"google-cloud"}