{"caseStudies":[],"domains":[{"id":1,"name":{"en":"Dummy domain 1","ja":"ダミーのドメイン 1"},"subObjectives":[{"id":"1.1","name":{"en":"Dummy sub-objective 1.1","ja":"ダミーのサブ項目 1.1"}},{"id":"1.2","name":{"en":"Dummy sub-objective 1.2","ja":"ダミーのサブ項目 1.2"}}],"weight":0.3},{"id":2,"name":{"en":"Dummy domain 2","ja":"ダミーのドメイン 2"},"subObjectives":[{"id":"NET.1","name":{"en":"Dummy sub-objective NET.1","ja":"ダミーのサブ項目 NET.1"}},{"id":"NET.2","name":{"en":"Dummy sub-objective NET.2","ja":"ダミーのサブ項目 NET.2"}}],"weight":0.3},{"id":3,"name":{"en":"Dummy domain 3","ja":"ダミーのドメイン 3"},"subObjectives":[{"id":"3.1","name":{"en":"Dummy sub-objective 3.1","ja":"ダミーのサブ項目 3.1"}}],"weight":0.2},{"id":4,"name":{"en":"Dummy domain 4","ja":"ダミーのドメイン 4"},"subObjectives":[{"id":"4.1","name":{"en":"Dummy sub-objective 4.1","ja":"ダミーのサブ項目 4.1"}}],"weight":0.2}],"features":{"caseStudies":false,"decisionTrees":false,"docs":true,"flashcards":true,"keywordDrills":false},"format":{"durationMinutes":90,"mockExam":{"caseStudiesPerSet":0,"questionCount":40,"setCount":2},"officialQuestionCount":{"max":50,"min":40},"questionKinds":["single"]},"guideURL":"https://example.com/certification/beta","guideVersion":"1.0","id":"test-beta","name":{"en":"Test exam Beta","ja":"テスト試験 Beta"},"scoring":{"policy":"allOrNothing"},"shortName":"BETA","taxonomies":{"wafPillars":[{"id":"resilience","name":{"en":"Dummy pillar resilience","ja":"ダミーの柱 resilience"}},{"id":"efficiency","name":{"en":"Dummy pillar efficiency","ja":"ダミーの柱 efficiency"}},{"id":"governance","name":{"en":"Dummy pillar governance","ja":"ダミーの柱 governance"}}]},"vendor":"example-cloud"}